{
  "formatVersion": "jiandu.validation-report/v1alpha1",
  "mode": "scoped",
  "sourceStoreId": "019d2a4a-7b00-7000-8000-000000000019",
  "snapshot": {
    "storeRevision": 4,
    "auditSequence": 4
  },
  "inspectedScopes": [
    {
      "kind": "project",
      "projectId": "prj_portable_export"
    },
    {
      "kind": "session",
      "sessionId": "ses_portable_export"
    }
  ],
  "findings": [],
  "truncated": false,
  "digest": "sha256:9a42168c491f2add131dc6896f27bf7270a65c049694100902071ea9cc3aaa73"
}
